Company_Brand,Sector,Stage,Amount,HeadQuarter,What it does,Year,Founded,Founders,Investor
KiranaKart,E-commerce,Pre-seed,720000.0,Mumbai,A better model for instant grocery delivery in India.,2021,2020,"Kaivalya Vohra, Aadit Palicha",Global Founders Capital
Meddo,Healthcare,Pre-series A,3000000.0,Gurgaon,Meddo is an end-to-end medical services provider,2021,2018,Saurabh Kochhar,"growX ventures, Venture Gurukool"
SP Robotic Works,EdTech,Series A,3000000.0,Chennai,An innovative place to explore next-generation technologies for students and all tech enthusiasts.,2021,2012,"Sneha Priya, Pranavan S",Mount Judi India Growth Fund
3SC,Logistics,Series B,15000000.0,Gurugram,An end-to-end supply chain analytics company that provides execution and analytics solutions which are comprehensive and customized.,2021,2018,"Lalit, Sarita Das",GEF Capital’s South Asia Fund
Chai Waale,Food & Beverages,,600000.0,Chennai,"A wide range of exotic flavoured chai, in the most hygienic ambience at pocket-friendly prices.",2021,2018,Vidur Maheswari,"Sunil Sethia, Sunil Kumar Singhvi, Manish Mardia"
Minimalist,Cosmetics,Series A,10000000.0,Jaipur,Affordable skincare for all,2021,2020,"Mohit, Rahul Yadav",Sequoia Capital
Biconomy,Blockchain,,9000000.0,New Delhi,Developer platform to enable a simplified transaction and onboarding experience for Web3 projects,2021,2019,"Aniket Jindal, Sachin Tomar","Mechanism Capital, DACM"
Fixcraft,Automotive,Pre-series A,1000000.0,Gurugram,India's Most Trusted Automotive Repair Brand,2021,2018,"Vivek Sharma, Abhishek Goyal, Inderjeet Rao",
Slice,Financial Services,,10000000.0,Bangalore,"Slice is India's best credit card challenger to pay bills, manage expenses, and unlock rewards",2021,2016,Rajan Bajaj,"Northern Arc Capital, Niyogin Fintech Limited, Credit Saison India, Vivriti Capital"
90+ My Tuition App,EdTech,Series A,5000000.0,Bangalore,Daskalos Virtual Academy Pvt Ltd is a company set up by a group of professionals who perform innovative work in management.,2021,2015,Vingish Vijay,Pearl Investment LLC
Wasabi,Consulting,Seed,1800000.0,Bangalore,Help small businesses grow their sales via our customer interaction and growth platform.,2021,2021,"Pradeep Dodle, Nikhil Goenka","021 Capital, Sparrow Capital"
Strata,Real Estate,Series A,6000000.0,Bangalore,Strata is an innovative tech-driven platform redefining Fractional Investments in Premium Commercial Real Estate,2021,2019,"Sudarshan Lodha, Priyanka Rathore","Kotak Investment Advisors Limited, Gruhas Proptech"
Ourbetterplanet,E-commerce,Seed,300000.0,Bangalore,A curated online marketplace for all things sustainable!,2021,2020,Pallavi Srivastava,VANS Group
Murf.ai,SaaS startup,Seed,1500000.0,Bangalore,"Murf AI is working on simplifying voice audio and making high-quality voice overs accessible to everyone, using artificial intelligence.",2021,2020,"Sneha Roy, Ankur Edkie, Divyanshu Pandey",Elevation Capital
JetSynthesys,Media,,2000000.0,Pune,"JetSynthesys is the group's most innovative company in the promising Digital and Technology Business World with a vision to create world class digital products, platforms and services in India",2021,2014,Rajan navani,Sachin Tendulkar
MYFITNESS,Fitness,Seed,1000000.0,Silvassa,"A new age D2C health & fitness brand with a mission to deliver products that taste good, feel good and do good.",2021,2019,"Mohammad Patel, Rahil Virani",9Unicorns
I am Love,Healthcare,Seed,4000000.0,Mumbai,"I am Love came into existence in early 2020, with the aim of redefining the relationship we have with our health.",2021,2020,Shilpa Rathi,Xentel Investments
MyGlamm,D2C,,40000000.0,Mumbai,MyGlamm is India’s fastest growing direct-to-consumer beauty brand.,2021,2015,"Darpan Sanghvi, Priyanka Gill",Accel Partners
Gumlet,IT,,1600000.0,Bangalore,Gumlet has built a new-age media delivery infrastructure that provides low code or no-code integration plugins that automate the entire media publishing pipeline.,2021,2019,"Divyesh Patel, Aditya Patadia",Sequoia’s Surge
Eloelo,Gaming,Pre-series A,2000000.0,Bangalore,Creator-led Social Gaming & Live Streaming Platform,2021,2015,"Saurabh Pandey, Akshay Dubey","Waterbridge, Lumikai"
Edukemy,EdTech,Pre-series A,2000000.0,Noida,"Edukemy is the first EdTech company in the country, in the non –STEM segment, offering an immersive learning experience to the students, supported by cutting-edge technology and an AI-based evaluation system.",2021,2020,Chandrahas Panigrahi,"Auxano, Falcon5"
Zingbus,Mobility,Pre-series A,5000000.0,Gurugram,Zingbus is a renowned brand in the bus operating industry.,2021,2019,"Mratunjay, Prashant Kumar, Ravi Kumar Verma",Infoedge ventures
NewsReach,Media,Seed,300000.0,Ahmedabad,NewsReach is a Mumbai based company that wants to create a disruptive ecosystem of original and local news content.,2021,2018,"Soniya Kundnani, Darshan Shah",JITO Angel Network
Pencilton,FinTech,Pre-seed,330000.0,Hyderabad,"India's first app for kids & teens to manage and spend pocket money while learning about money in a fun, gamified way.",2021,2017,"VishwajitPureti, Ashish Singh, Pallavi Tipparaju, Viraj Gadde",Jupiter
Bandhoo,IT,,1000000.0,Gurugram,"Bringing ease of eCommerce to Construction for builders, infrastructure companies, contractors and workers",2021,2020,"Prashant Gupta, Sridhar Sundaram",Unitus Ventures
ixigo,IT,,53000000.0,Gurugram,"AI-based travel app offering seamless planning and booking for flights, trains, buses, hotels and more!",2021,2007,"Rajnish Kumar, Aloke Bajpai","GIC, Infoedge"
The Whole Truth,Food & Beverages,Series A,6000000.0,Mumbai,"Believe simple, homely ingredients, minimally processed, are the secret to nutritious, tasty food",2021,2019,Shashank Mehta,Sequoia Capital
Insane AI,Fitness,Seed,800000.0,Bangalore,Mainstream fitness formats are a primitive solution to the modern problems of a sedentary lifestyle.,2021,2021,"Anurag Mundhada, Jayesh Hannurkar, Sourabh Agrawal",pi Ventures
Droom,Automobile,,200000000.0,Gurugram,"Droom is an AI and data science driven online transactional platform, which offers 21st century experience in buying & selling used & new automobiles in India",2021,2014,Sandeep Aggarwal,
Skymet,Environmental Services,,1000000.0,Noida,Provide services that allow clients to understand and organize themselves around changing environment.,2021,2003,Yogesh Patil,"Northern Arc, Caspian Impact Investments"
Go Swift,Consumer Services,Pre-series A,2000000.0,Bangalore,Help small & medium sized businesses to grow by helping them with their shipping requirements at the cheapest and most reliable service.,2021,2019,"Shyam Kalita, Debanshu Sinha, Prayas Mittal",Kalaari Capital
Mamaearth,Healthcare,,50000000.0,Gurugram,A brand which develops products from world-class research and attempts to solve every little problem that we as parents face.,2021,2016,"Varun Alagh, Ghazal Alagh",Sofina Ventures SA
G.O.A.T,D2C,Series A,36000000.0,Bangalore,G.O.A.T Brand Labs provides a tech-enabled platform for D2C brands to scale.,2021,2021,"Rishi Vasudev, Rameswar Misra","Tiger Global, Flipkart Ventures"
ReDesyn,Merchandise,Pre-series A,300000.0,Mumbai,"Merchandise drop-shipping platform for influencers, designers, creators & brands.",2021,2016,"Smriti Dubey, Shikhar Vaidya",Anthill Ventures
Inspacco,Facilities Services,,200000.0,Pune,"For residential commercial and industrial establishments , Inspacco is a one stop solution , that delivers affordable improvement and maintenance services",2021,2019,"Sanket Nerkar, Paresh Kotkar",
Knorish,EdTech,Pre-series A,1000000.0,Gurugram,"Saas platform offers a feature packed platform enables businesses, experts, professionals, artists, instructors, specialists, coaches, people seeking work from home opportunities",2021,2016,"Rakhi Wadhwa, Kinner N Sacchdev","Inflection Point Ventures, Rockstud Capital, Pentathlon Ventures, Prophetic Ventures syndicate"
Dozee,Healthcare,Series A,5000000.0,Bangalore,"Dozee is India's only contactless health monitor that silently tracks your heart, respiration, sleep patterns, stress levels, cardiac contractions, apnea and more while you sleep.",2021,2015,"Mudit Dandwate, Dandwate",Prime VP
BlackBuck,Logistics & Supply Chain,Series E,67000000.0,Bangalore,BlackBuck marks the beginning of a new path in trucking. A path that is organized and makes trucking simple for every shipper and trucker.,2021,2015,"B Ramasubramanian, Chanakya Hridaya, Rajesh Yabaji","Tribe Capital, IFC Emerging Asia Fund, VEF"
Mailmodo,Marketing & Advertising,Seed,2000000.0,Bangalore,Mailmodo is a complete email marketing solution enabling users to create and send app-like interactive emails to improve email conversions.,2021,2020,"Aquibur Rahman, Apurv Gupta, Devyesh Tandon","Sequoia’s Surge, Y Combinator"
NirogStreet,Healthcare,Series A,2500000.0,New Delhi,Nirogstreet as a concept is working to make #Ayurveda first call of treatment.,2021,2018,Ram N Kumar,"Gokul Rajaram, Pureland Venture, Wavemaker Partners"
Even,Healthcare,Seed,5000000.0,Bangalore,One monthly subscription to cover all your healthcare needs.,2021,2020,"Mayank Banerjee, Matilde Giglio, Alessandro Davide Ialongo",Khosla Ventures
Captain Fresh,Logistics,Series A,12000000.0,Bangalore,A B2B marketplace leveraging technology to deliver the fastest harvest-to-retail in the industry.,2021,2019,Utham Gowda,"Accel Partners, Matrix India"
Otipy,Food & Beverages,Series A,10200000.0,Gurugram,Otipy helps the farmer to deliver farm fresh vegetables & fruits at doorstep.,2021,2020,Varun Khurana,"Omidyar Network India, Innoven Capital"
Lenskart,Eyewear,,220000000.0,Faridabad,India's fastest growing eyewear company and largest eyewear company online.,2021,2008,Peyush Bansal,"Temasek, Falcon Edge"
Eka.care,Healthcare,,4500000.0,Bangalore,A digitally enabled and connected healthcare ecosystem for better health outcomes.,2021,2020,Vikalp Sahni,"Deep Kalra, Ashish Kashyap, Rajesh Magow"
Braingroom,EdTech,,200000.0,Chennai,"BrainGroom is an online marketplace for educational, recreational & wellness classes with defined target segment, quantifiable outcomes & specified time duration.",2021,2015,"Madhula Sathyamoorthy, Naliene Ramasamy, Kalaiarsi Periasamy","IAN, Social Alpha, Startup Oasis"
Edvizo,Consumer Services,Pre-series A,1000000.0,Bangalore,"Edvizo is an online marketplace to help students and parents find, compare and enroll in the best and trusted private institutes in their locality",2021,2017,Ravi Nishant,Inflection Point Ventures
Credenc,FinTech,,25000000.0,New Delhi,An education loan platform to finance meritorious students for the college expenses by underwriting future employability,2021,2017,Avinash Kumar,Capital India
GlobalBees,D2C Business,Series A,150000000.0,New Delhi,Globalbees partners with entrepreneurs who have built an online-first business.  Our team scales up D2C businesses in India and abroad.,2021,2021,Nitin Agarwal,"FirstCry, Lightspeed Venture Partners"
Spinny,Automotive,Series D,108000000.0,Gurugram,Spinny is a new age used car end-to-end platform in India.,2021,2015,"Niraj Singh, Mohit Gupta, Ramanshu Mahaur",Tiger Global
Mynvax,Biotechnology,Series A,4000000.0,Bangalore,Mynvax is a pre-clinical stage vaccine biotechnology. Current develop programs include a recombinant vaccine for human influenza and COVID19.,2021,2017,"Dr Raghavan Varadarajan, Dr Gautham Nadig","Accel, LetsVenture, 1Crowd"
RiseBird,Human Resources,,500000.0,Pune,RiseBird provides on-demand 2.5K + expert video interviews and A.I. powered insights to help companies hire online.,2021,2018,Ashutosh Seth,SAB Holdings
Uvi Health,Healthcare,Pre-seed,330000.0,Bangalore,Digital health platform delivering personalized care for women’s sexual and reproductive health concerns,2021,2020,Mehak Malik,Titan Capital
Vegrow,Farming,,13000000.0,Bangalore,Vegrow is in the business of fresh fruits & vegetables with addressable market size of $43 Billion.,2021,2020,"Praneeth Kumar, Shobhit Jain, Mrudhukar Batchu, Kiran Naik","Lightspeed Venture Partners, Elevation Capital"
Automovill,Automotive,,500000.0,Bangalore,"Automovill is a unique platform to aggregate automobile service providers, where we connect vehicle owners with all kind of automobile service providers under one roof.",2021,2015,"Mridu Mahendra Das, Chinmay Baruah",Mumbai Angels Network
HealthifyMe,Healthcare,Series C,75000000.0,Bangalore,HealthifyMe is a revolutionary health and fitness application that is on a mission to transform a billion lives!,2021,2012,"Tushar Vashisht, Sachin Shenoy","LeapFrog, Khosla Ventures"
GalaxyCard,FinTech,,450000.0,Gurugram,GalaxyCard is a mobile based Instant Credit Card.,2021,2017,Amit Kumar,JITO Angel Network
Bella Vita Organic,Healthcare,,10000000.0,Gurugram,Bella Vita Organic or ‘The Good Life’ is dedicated to creating handcrafted and organic beauty solutions inspired by the natural elements of the earth and age old beauty best practices.,2021,2018,Aakash Anand,Ananta Capital
SmartCoin,FinTech,,10000000.0,Bangalore,India's Most Preferred Instant Loan App,2021,2016,"Jayant Upadhyay, Amit Chandel, Rohit Garg","Northern Arc, Vivriti Capital"
MYSUN,Solar,,2000000.0,New Delhi,"India's Largest Online Rooftop Solar Platform for SMEs, Industries & Homes",2021,2016,Gagan Vermani,TATA Cleantech Capital
Sea6 Energy,Biotechnology,Series B,9000000.0,Bangalore,"Sea6 Energy envisions a future where the abundant oceans will be our biomass farms of tomorrow - to provide solutions in energy, agriculture and food.",2021,2010,"Sailaja Nori, Nelson Vadassery, Sowmya Balendiran, Shrikumar Suryanarayan",Aqua-Spark
Beco,Consumer Goods,Seed,500000.0,Mumbai,"Eco-friendly home and kitchen care products that are plastic-free, high in quality and affordable.",2021,2018,"Aditya Ruia, Akshay Varma, Anuj Ruia",Climate Angels Fund
OneCode,Internet,,5000000.0,Bangalore,"OneCode is a platform which connects new age digital first brands with ""relevant"" sellers (aka OneCoders) to sell their products and services",2021,2020,"Manish Shara, Yash Desai","Sequoia’s Surge, Nexus Venture Partners"
MedPay,Information Technology,Seed,1200000.0,Bangalore,MedPay® is building the real-time claims adjudication platform for health insurers.,2021,2020,"Arun Bhatia, Ravi Chandra","Entrepreneur First (EF), GrowX Ventures"
Inshorts,Internet,,60000000.0,Noida,Built Inshorts with a promise to deliver news,2021,2013,Azhar Iqubal,Vy Capital
Digantara,SpaceTech,Seed,2500000.0,Bangalore,"Digantara is an Indian Space Technology Company incubated at Indian Institute of Science (IISc), establishing a space-based surveillance platform with global realtime earth coverage",2021,2018,"Anirudh N Sharma, Rahul Rawat, Tanveer Ahmed",Kalaari Capital
Aqgromalin,AgriTech,Seed,700000.0,Chennai,Aqgormalin is a tech driven farm diversification platform enabling farmers to diversify into Animal Husbandry and Aquaculture.,2021,2018,"Prasanna Manogaran, Bharani CL",Zephyr Peacock
Square Yards,Real Estate,,25000000.0,Gurugram,India’s largest tech enabled Real Estate Brokerage and Mortgage Marketplace,2021,2014,Tanuj Shori,ADM Capital
OYO,Hospitality,,660000000.0,Gurugram,OYO is a global platform that empowers entrepreneurs and small businesses with hotels and homes by providing full-stack technology,2021,2013,Ritesh Agarwal,"SoftBank Vision Fund, Hindustan Media Venture"
Ola Electric,Automotive,Debt,100000000.0,Bangalore,Ola Electric - The future of mobility is here.? Charging ahead to accelerate the world’s transition to sustainable mobility.,2021,2017,Bhavish Aggarwal,Bank of Baroda
Bikry app,Consumer software,,1300000.0,Noida,"Bikry, a Direct-to-Customer platform to start your online store within 30 seconds at 0% commission",2021,2019,Abhishek Bhayana,YCombinator
Oliveboard,EdTech,,3000000.0,Bangalore,Oliveboard is the top exam preparation platform for Banking & Government Exams.,2021,2012,"Abhishek Patil, V Satish Kumar",IAN Fund
Trell,Social commerce,Series B,45000000.0,Bangalore,India's Largest Lifestyle Social Commerce platform. Empowering millions of storytellers & Micro-Entrepreneurs.,2021,2016,"Pulkit Agarwal, Prashant Sachan, Arun Lodhi, Bimal Kartheek Rebba","Mirae Asset, H&M"
Kredent,EdTech,,1000000.0,Kolkata,Kredent Academy is the unique concept where financial market professionals have taken the onus of creating a strong knowledge bank in their area of expertise,2021,2008,"Vineet Patawari, Vivek Bajaj, Vinay Pagaria",Kotak Securities
EasyAspataal,Healthcare,Seed,500000.0,Mumbai,India’s First Digital Admission Desk for Hospitalisation.,2021,2020,"Manoj Gupta, Gunjali Kothari",Venture Catalysts
Pankhuri,Social community,,3200000.0,Bangalore,"Pankhuri is a women's only community for members to socialize, explore and upskill through live interactive courses, expert chat and interest-based clubs.",2021,2019,Pankhuri Shrivastava,Sequoia’s Surge
Arcana,Information Technology,Seed,370000.0,Bangalore,Arcana is the Storage Layer of Ethereum.,2021,2019,"Mayur Relekar, Aravindh Kumar, Abhishek Chaudhary",Balaji Srinivasan
Aquaconnect,Fishery,Pre-series A,4000000.0,Chennai,Aquaconnect is a global full-stack aquaculture technology venture that provides data-driven farm advisory and marketplace solutions to fish and shrimp farmers,2021,2017,Rajamanohar,"Rebright Partners, Flourish Ventures"
Vah Vah!,EdTech,,1800000.0,Bangalore,A mission to educate India and make its young and dynamic population job ready.,2021,2020,"Shailesh Daxini, Akash Senapaty, Muthukaleeshwaran Subbiah",Sequoia Surge
LetsDressUp,Apparel & Fashion,Pre-series A,300000.0,Gurugram,Building India's version of Stitch Fix,2021,2019,Aditya B,"Titan Capital, Sequoia Capital"
Sapio Analytics,Computer software,,150000.0,Mumbai,Aim to provide the most intelligent AI-powered policy making solutions for government institutions across the world.,2021,2019,"Ashwin Srivastava, Hardik Somani, Prashant Nikam",Parthiv Group
Pratilipi,Online storytelling,,48000000.0,Bangalore,"Pratilipi is the largest Indian language self-publishing platform with over 350,000 authors and more than 28,000,000 unique monthly readers.",2021,2015,Ranjeet Pratap Singh,"Krafton Inc, Omidyar"
Ati Motors,Automotive,Pre-series A,35000000.0,Bangalore,Autonomous industrial vehicle maker,2021,2017,"Saurabh Chandra, Saad Nasser","Blume Ventures, Exfinity Venture Partners"
peAR,Deeptech,Pre-series A1,300000.0,Mumbai,An AR / VR tech based Start-up in Mumbai.,2021,2018,"Dharmin Vora, Dhruvesh Mehta, Parth Vora",Inflection Point Ventures
Gourmet Garden,Farming,,3000000.0,Bangalore,"100% contamination free, pesticide free naturoponically grown vegetables.",2021,2019,Arjun Balaji,"Beyond Next Ventures, M Venture Partners"
The Sleep Company,Consumer Goods,Pre-series A,1000000.0,Mumbai,Patent Pending sleep technology developed by actual Rocket Scientists and sleep experts after years of research.,2021,2019,,Fireside Ventures
ION Energy,Automotive,Pre-series A,3600000.0,Mumbai,Advanced Electronics & Software Supplier for Electric Vehicles & Battery Energy Storage,2021,2016,Akhil Aryan,
Digit Insurance,Insuretech,,200000000.0,Bangalore,"Digit becomes the first Unicorn of 2021, valued at $1.9B.",2021,2016,Kamesh Goyal,"Faering Capital, Sequoia Capital India, IIFL Alternate Asset Managers"
FRAAZO,Food & Beverages,Series A,11000000.0,Mumbai,FRAAZO is Mumbai's favourite App for Fresh Vegetables and Fruits coming straight from the Farm to your Doorstep within 18 Hours.,2021,2020,"Atul Kumar, Aashish Krishnatre","Sixth Sense Ventures, NABVENTURES"
Licious,Food & Beverages,Series F,192000000.0,Bangalore,"Licious is a consumer food company, focussed at delighting the world with an unmatched range of meat & meat products.",2021,2015,"Abhay Hanjura, Vivek Gupta","Temasek, Multiples PE"
WinZO,Gaming,Series C,65000000.0,New Delhi,WinZO is the largest social gaming and entertainment platform in India.,2021,2018,Paavan Nanda,Griffin Gaming Partners
Furlenco,Consumer Goods,,100000000.0,Bangalore,Furlenco is a different furniture company.,2021,2012,Ajith Mohan Karimpana,Zinnia Global
Skylark Drones,Aviation,Pre-series A,3000000.0,Bangalore,"Enterprise drone solutions that help plan, build, and sustain the world we live in.",2021,2014,Mughilan Thiru Ramasamy,"InfoEdge Ventures, IAN Fund"
TWID,FinTech,,2500000.0,Bangalore,"TWID is shaping the future of Digital Currencies, delivering new-age fintech solutions",2021,2020,"Amit Sharma, Amit Koshal, Rishi Batra","BEENEXT, Sequoia’s Surge"
MyMobiForce,Internet,Pre-series A,1400000.0,Noida,"Crowdsourcing platform imparting best-in-class services with immensely talented, skilled & qualified workforce pan-India",2021,2018,"Dheeraj Khatter, Himanshu Kumar, Kshitiz Saini",Bharat Inclusion
Pine Labs,Information Technology,,600000.0,Noida,A merchant platform company that provides financing and last-mile retail transaction technology to merchants,2021,1998,Amrish Rau,"Fidelity, BlackRock"
Genworks Health,Healthcare,,2000000.0,Bangalore,GENWORKS Health is an initiative by GE for empowering healthcare professionals operating in the rural areas to deliver better medical facilities and diagnostics while keeping things affordable.,2021,2015,S Ganeshprasad,Blacksoil
Neverinstall,Information Technology,Seed,370000.0,Bangalore,A cloud platform to bring any GUI application regardless of OS and Device type to the browser.,2021,2019,"Lakshmana Pasala, Ram Pasala",Speciale Invest
BeatO,Healthcare,Pre-series B,5000000.0,New Delhi,ULTIMATE app to manage chronic conditions.,2021,2015,Gautam Chopra,W Health Ventures
Earth Rhythm,Cosmetics,Seed,1200000.0,Gurugram,A mission to make customers healthier and Earth a little greener.,2021,2020,Harini Sivakumar,Anicut Angel Fund
Fountain9,Computer software,Seed,1900000.0,Mumbai,"Fountain9 is a Y Combinator backed company, which offers predictive inventory planning and optimization software for e-commerce, DTC and retail companies.",2021,2019,"Niki Khokale, Rajas Lonkar","021 Capital, Y Combinator"
Rockclimber,Food & Beverages,,1000000.0,Bangalore,RockClimber is a new age beverage brand with a portfolio of alcoholic and non alcoholic drinks.,2021,2019,"Deepak Poduval, Hariprasad Shetty",Anand Prakash Sharma
SpEd@home,EdTech,,300000.0,Mumbai,"Provide Remediation, Occupational Therapy, Speech Therapy and Socio-emotional coaching for children with Learning Disabilities like Dyslexia, Dysgraphia, Dyscalculia",2021,2020,Dhaval Mody,
Green Soul,Consumer Goods,,200000.0,Ambernath,Green Soul is No.1 brand on Amazon India in Ergonomic chairs category in terms of customer reviews.,2021,2016,Ravi Khushwani,velocity.in
Shiprocket,Logistics,Series D1,41000000.0,New Delhi,India's #1 eCommerce Logistics and Shipping Solution Empowering over 1 Lakh Indian eCommerce Sellers.,2021,2012,"Saahil Goel, Akshay Ghulati","March Capital, Tribe Capital"
DealShare,Retail,,144000000.0,Bangalore,The next generation disruptive (social) e-commerce product for the masses.,2021,2018,"Rajat Shikhar, Vineet Rao, Sourjyendu Medda",Tiger Global
Teachmint,EdTech,Pre-series B,20000000.0,Bangalore,Teachmint is an all-in-one education technology platform created specifically for the tutors of the digital age.,2021,2020,"Mihir Gupta, Payoj Jain, Divyansh Bordia, Anshuman Kumar",Learn Capital
Vahak,Transportation,Pre-series A,5000000.0,Bangalore,Building India's Largest & Most Trusted Online Transport Marketplace & Directory,2021,2017,"Vikas Chandrawat, Karan Shaha",RTP Global
goSTOPS,Hospitality,Pre-series A,1000000.0,New Delhi,goSTOPS aims to be India’s biggest and most loved backpacker hostel brand.,2021,2014,"Pallavi Agarwal, Pankaj Parwanda","IAN, Yuj Ventures"
Powerplay,Construction,,5200000.0,Bangalore,Powerplay helps simplify end to end Construction and Architecture project management.,2021,2020,"Shubham Goyal, Lesh Dixit","Sequoia’s Surge, Accel Partners"
Delhivery,Logistics,Series H,270000000.0,Gurugram,"Delhivery is a supply chain services company that provides transportation, warehousing, freight, and order fulfillment services.",2021,2011,"Bhavesh Manglani, Kapil Bharati, Mohit Tandon, Sahil Barua, Suraj Saharan","Fidelity, GIC"
Avishkaar,EdTech,Pre-series A,600000.0,New Delhi,India's leading Ed-Tech startup spearheading the Maker Revolution in the sub-continent,2021,2014,"Rajeev Gaba, Tarun Bhalla",Auxano
Jobsgaar,Job discovery platform,Seed,140000.0,New Delhi,India's first District level/ Hyper Local Job discovery platform,2021,2020,Atul Pratap Singh,SucSEED Indovation Fund
Breathe Well-being,HealthCare,Pre-series A,1000000.0,New Delhi,Breathe Wellbeing is an interactive and personalized platform that helps organization increase employee engagement and productivity.,2021,2015,"Aditya Kaicker, Rohan Verma","Stanford Angels and Entrepreneurs India, Anjali Bansal"
Good Health Clinic,HealthCare,,5000000.0,Hyderabad,Full Stack Digital Health Clinic,2021,2021,Samarth Sindhi,Khosla Ventures
Urban Company,Home services,Series F,250000000.0,New Delhi,Urban Company is an India-based company providing a marketplace for freelance labor.,2021,2014,"Abhiraj Singh Bhal, Raghav Chandra, Varun Khaitan","Vy Capital, Wellington Management"
MYBYK,Rental,Pre-series A,1000000.0,Ahmadabad,MYBYK is an app that provides premium bicycle sharing and rental service.,2021,2014,Arjit Soni,Avon Cycles
Locus,Logistics,Series C,50000000.0,Bangalore,Locus is an intelligent decision-making and automation platform for logistics.,2021,2015,"Geet Garg, Nishith Rastogi","Blume Ventures, Exfinity Venture Partners"
Crejo.Fun,EdTech,Seed,3000000.0,Bangalore,Crejo.Fun is a digital extracurricular learning platform being built with an intent to help children discover their passions and interests through creative learning.,2021,2020,Vikas Bansal,"Matrix Partners India, 021 Capital"
Bambinos,EdTech,Seed,500000.0,Bangalore,Cohort based extracurricular course for kids,2021,2020,"Ashish Gupta, Ankit Hetamsaria","HNIs, Angels"
