Company_Brand,Sector,Stage,Amount,HeadQuarter,What it does,Year,Founded,Founders,Investor
Akna Medical,Healthtech,,7000000.0,,Provides supply solutions for surgical and pharmaceutical products.,2020,2018,"Saurabh Pandey, Mahadevan Narayanamoni",LGT Lightstone Aspada
Zomato,Foodtech,,5000000.0,Gurugram,Online food delivery and restaurant discovery platform,2020,2016,Deepinder Goyal,Pacific Horizon
RaRa Delivery,Logistics,Seed Round,800000.0,,Provides same day delivery service for ecommerce businesses,2020,2016,Karan Bhardwaj,"Der Shing Lim, 500 startups"
JusPay,Fintech,Series B,21600000.0,Bangalore,Online payment solutions,2020,2016,Vimal Kumar,Vostok Emerging Finance
Obviously AI,Data Science,,113866383.83,,It provides predictive insights to clients by leveraging their data,2020,2018,"Tapojit Debnath, Nirman Dave",Arka Venture Labs
Fingpay,Fintech,Series A,3500000.0,Mumbai,Provides payment solutions,2020,2016,"Pratyush Halen, Anuraag Agrawal",IvyCap Ventures
Recko,SaaS,Series A,6000000.0,Bangalore,The platform enables AI-powered reconciliation of digital transactions,2020,2017,"Prashant Border, Saurya Prakash Sinha",Vertex Ventures
Furlenco,Ecommerce,,10000000.0,Bangalore,Furniture rental startup,2020,2012,Ajith Mohan Karimpana,"Chowdry Associates, Lightbox"
Mera Cashier,Fintech,,150000.0,Noida,App meant for small and micro businessmen to manage their transactions digitally,2020,2019,"Suneel Kumar, Gaurav Tomar, Sucharita Redd","Sukhbir Singh, India Accelerator, Boudhik Ventures, Shankar Nath, Shaurya Garg"
Kitchens Centre,,Seed Round,500000.0,Delhi,Offers solutions to cloud kitchens by providing commercial space and kitchen infrastructure to assisting with branding and other services,2020,2019,Lakshay Jain,AngelList India
Camp K12,Edtech,Seed Round,4000000.0,Gurugram,It connects students with tutors online,2020,2016,"Anshul Bhagi, Sandeep Bhagi","Matrix Partners, SAIF Partners"
MedGenome,Healthtech,Series D,55000000.0,Bangalore,Genetic diagnostic testing company,2020,2013,Sam Santhosh,LeapFrog Investments
Ergos,Agritech,,4598000.0,Bangalore,It enables farmers to digitise their foodgrain and also provide access to supply chain solutions,2020,2016,"Kishor Jha, Praveen Kumar",Aavishkar Capital
Nykaa,Ecommerce,,13137000.0,Mumbai,Deals in cosmetic and wellness products,2020,2012,Falguni Nayar,Steadview capital
Samadhan,Insurance,Seed Round,113866383.83,Delhi,They help find solutions to insurance related issues,2020,2018,"Deepak Bhuvneshwari Uniyal, Shilpa Arora, Shailesh Kumar, Sanjay Aggarwal",Venture Catalysts
SaScan,Healthcare,,113866383.83,Bangalore,Cancer diagnostics startup,2020,2016,Subhash Narayanan,Unicorn India ventures
Lido Learning,Edtech,,3000000.0,Mumbai,Online teaching service,2020,2016,Sahil Sheth,"Pecus Capital, Madhur Deora"
CureFit,Health and Fitness,Series D,115000000.0,Bangalore,"Integrated platform for food, fitness and meditation.",2020,2016,"Mukesh Bansal, Ankit Nagori",Temasek
Nimesa,SaaS,,113866383.83,Bangalore,Cloud data managemnt solutions enterprise,2020,2018,"Tapesh Goyal, Rajesh Vaidhyanathan",Ideaspring capital
Design X,IoT,Seed Round,200000.0,Noida,Builds IoT based products,2020,2016,Preet Arjun Singh,ThinkNext LLC
Driftly Electric,Automobile,,113866383.83,Bangalore,Electric vehicle startup,2020,2016,Sneha Roy,MG Motor India
Imstrong,Fitness,Seed Round,400000.0,Bangalore,It is an online and live video-streaming platform that allows trainers and fitness enthusiasts to connect and engage in interactive online classes.,2020,2019,"Dilip Kumar, Selvan Thamarai, Deepti Nair",Rainmatter
Craftsvilla,Marketplace,,3900000.0,Mumbai,Online marketplace for ethnic wear,2020,2016,Monica Gupta. Manoj Gupta,Supera Investments
Rupifi,Fintech,Pre seed round,113866383.83,Bangalore,Offers financial products for SMEs,2020,2020,"Anubhav Jain, Ankit Singh, Jawaid Iqbal","Ashneer Grover, Kunal Shah, Ramakant Sharma"
SnackAmor,Food,Seed Round,113866383.83,Mumbai,It offers various healthy snacks,2020,2016,Deepak Grover,Undisclosed
Zealthy,Healthtech,Seed Round,113866383.83,Bangalore,"It connects women to healthproviders for specialities like infertility, maternity etc.,",2020,2019,"Rishi Malhotra, Akhil Gupta","KYT Ventures, First Cheque, AngelList"
CoinDCX,Fintech,Series A,3000000.0,,A cryptocurrency trading platform,2020,2016,Sumit Gupta,"Polychain Capital, Bain Capital Ventures, HDR Group"
NuNu TV,Media,,670000.0,,Kids-focussed Youtube channel,2020,2016,,Risers Accelerators
QTalk,Technology,Seed Round,1600000.0,Bangalore,Smart Phone Dialer,2020,2016,"Sagar Modi, Advaith Vishwanath","Accel India, Lightspeed Venture Partners"
Shadez,Interior & decor,Seed Round,100000.0,Mumbai,Paint Company,2020,2018,"Adarsh Anand, Amit Tiwari",Inflection Point Ventures
Excess2Sell,Ecommerce,,1000000.0,Mumbai,B2B Marketplace for Overstock & Surplus Inventory,2020,2016,Rajan Sharma,Gautham Madhavan
Stanplus,Healthtech,Pre series A,1500000.0,Hyderabad,Ambulance service,2020,2016,Prabhdeep Singh,Pegasus FinInvest
Pitstop,Automobile,Series A,2500000.0,Bangalore,Doorstep car service,2020,2016,Mihir Mohan mishra,TPG-backed Group Landmark
Univariety,Edtech,,1100000.0,Hyderabad,Online marketplace that provides career counselling and college guidance,2020,2015,Jaideep Gupta,Info Edge
Peel Works,SaaS,"Series C, D",113866383.83,Mumbai,E-commerce for corner/retail stores.,2020,2010,"Sachin Chhabra, Nidhi Ramachandran",CESC Ventures
CoreStack,Technology,Series A,8500000.0,Chennai,Enterprise cloud governance technology startup,2020,2016,"Ezhilarasan Natarajan, Sabapathy Arumugam, Krishnakumar Narayanan, Thiruvalluvar NB",Naya Ventures
Vivriti Capital,Fintech,Series B,50000000.0,Chennai,Digital lending startup,2020,2017,"Gaurav Kumar, Vineet Sukumar",LGT Lightstone Aspada
Agnikul,Spacetech,Pre series A,3148000.0,Chennai,"It designs, fabricates, tests and launch orbital class launch vehicles",2020,2016,Srinath Ravichandran,pi Ventures
Fintso,Fintech,,2600000.0,,Wealth management platform,2020,2020,"George Mitra, Rajan Pathak","Rajeev Juneja, Pratul Shroff, Dilip Khandelwal, Piyush Gupta"
Khatabook,Fintech,,113866383.83,Bangalore,It helps SMEs to maintain their accounts and ledger online.,2020,2016,Ravish Naresh,Mahendra Singh Dhoni
Smart Coin,Fintech,Series A,7000000.0,,Consumer lending startup,2020,2015,"Amit Chandel, Rohit Garg, Vinay Kumar, Jayant Upadhyay",LGT LightstoneAspada
ZunRoof,Cleantech,Series A,3000000.0,Gurugram,"It specialises in solar rooftop design, installation, and management using technology",2020,2016,"Pranesh Chaudhary, Sushant Sachan",Godrej Investments
Shop101,Social e-commerce,Series C,3900000.0,,Enables entrepreneurs to sell online,2020,2015,"Abhinav Jain, Aditya Gupta","Stellaris Venture Partners, Unilever Ventures, Kalaari Capital, Vy Capital"
OM Bhakti,FMCG,Seed Round,113866383.83,Bangalore,A puja cotton-wicks manufacturing startup,2020,2016,"Sridhar Joshi, Prashant Kulkarni",Venture Catalysts
Lal10,B2B,,1100000.0,Uttar Pradesh,It helps Indian artisans and SMEs reach out to global retailers,2020,2016,"Maneet Gohil, Sanchit Govil, Albin Jose",Sorenson Impact
Anaxee Digital Runner,Tech,,113866383.83,Indore,A tech-enabled ID verification and data collection startup,2020,2016,"Govind Agrawal, Arti Agrawal",Orios Venture Partners
CollegeKhabri,Edtech,,113866383.83,Bhopal,Platform is an end-to-end college and career counselling platform for students,2020,2019,Arshi Khan,Vishal Dixit
Ola Electric,eMobility,,1000000.0,Bangalore,Electric vehicle,2020,2016,"Ankit Jain, Anand Shah",Pawan Munjal Family Trust Fund
Multi Living,Real Estate,,6000000.0,Mumbai,"It curates apartments from the homeowners, performs the quality check and offers the homes with built-in services to the potential tenants",2020,2016,Pankaj Singh,Lodha Ventures
FamPay,Fintech,Seed Round,4700000.0,Bangalore,"It allows parents to send money to their kids below the age of 18, which they can spend securely under parent supervision.",2020,2016,Kush Taneja,"Y Combinator, Venture Highway, Sequoia India, Global Founders Capital"
UnboxRobotics Labs,Automation tech,Seed Round,500000.0,Bangalore,Automated flexible parcel sorting solutions for logistics providers,2020,2016,Pramod Ghadge,"Arali Ventures, CIIE.CO"
Karbon Card,Fintech,Seed Round,2000000.0,Bangalore,Specialisde corporate cards for startups,2020,2016,"Pei-fu Hsieh, Amit Jangir","Kunal Shah, Amrish Rau, Jitendra Gupta"
Airmeet,Media & Networking,,3000000.0,Bangalore,"A platform to host, discover, and attend fully remote events like conferences and professional meet-ups",2020,2016,"Lalit Mangal, Vinay Jaasti, Manoj Singh",Accel India
Innerchef,Foodtech,,1000000.0,Gurgaon,Cloud kitchen platform,2020,2016,Rajesh,Mistletoe
Epigamia,FMCG,Series C,113866383.83,Mumbai,Flavoured and greek yoghurt brand,2020,2015,Rohan Mirchandani,KA Enterprise
StyleNook,Ecommerce,,113866383.83,Mumbai,Marketplace for fashionable apparel,2020,2016,Lathika Pai,"Lead Angels Network, Stanford Angels"
Callido Learning,Edtech,,113866383.83,Mumbai,Provides a structured educational approach to critical thinking and problem solving skills,2020,2016,Sriram Subramanian,Education Catalyst Fund
Soxytoes,Ecommerce,,113866383.83,Delhi,Online store to buy various types of socks including funky and colorful socks,2020,2016,"Vidushi Kajaria, Aayush Goenka",Angel network
F5,E-market,Seed Round,113866383.83,Delhi,Retail Aggregator,2020,2018,"Raghav Arora, Lalit Kumar Aggarwal",LetsVenture investors
Paper Boat,Food & Beverages,,4049500.0,Bangalore,Ecommerce platform for beverages and snacks,2020,2013,"Neeraj Kakkar, James Nutall, Suhas Misra, Neeraj Biyani","Advent Management, A91 Emerging Fund, Trifecta Venture"
Strata,Proptech,Seed Round,1500000.0,Bangalore,Real estate investment platform,2020,2019,"Sudarshan Lodha, Priyanka Rathore","SAIF Partners, Mayfield India"
Salesken,AI & Data science,Series A,8000000.0,Bangalore,Provides sales professionals with intelligence on various aspects of the sales pitch,2020,2016,"Sreeraman Vaidyanathan, Surga Thilakan",Sequoia India
Arya,Agritech,Series B,6000000.0,Noida,Provides post-harvest services across the agricultural value chain,2020,2016,Prasanna Rao,LGT Lightstone Aspada
Leap Finance,Fintech,,5500000.0,Bangalore,Provides education loans to students based on the student’s future income,2020,2016,"Vaibhav Singh, Arnav Kumar",Sequoia India
Sleepy Owl,Beverages,,113866383.83,Delhi,"It sells ready to drink cold brew coffees, brew boxes and packs.",2020,2016,"Ajai Thandi, Arman Sood, Ashwajeet Singh",Rukam Capital
Tricog,Healthtech,Series B,10500000.0,Bangalore,Provides virtual cardiology services through its AI-powered healthcare platforms,2020,2015,"Charit Bhograj, Zainul Charbiwala, Udayan Dasgupta, Abhinav Gujjar","UTEC-The University of Tokyo Edge Capital, Aflac Ventures, LLC, Dream Incubator, TeamFund"
GogoBus,Travel tech,,113866383.83,Delhi,Inter-City Mobility Startup,2020,2016,Amit Gupta,Ixigo
Trell,Social e-commerce,Pre series A,4000000.0,Bangalore,Allows users to share their travel experiences,2020,2016,"Pulkit Agrawal, Prashant Sachan, Arun Lodhi, Bimal Kartheek Rebba, Nirav Sheth","Sequoia’s Surge, Fosun RZ"
Spaciya Consultants,Real Estate,Pre series A,500000.0,Noida,Real estate consultancy firms,2020,2016,Ajit Panda,Alok Garg
Bounce,Automotive and Rentals,,6500000.0,Bangalore,Offers a variety of bikes and scooters that can be rented on a subscription basis,2020,2014,"Vivekananda Hallekere, Anil Giri Raju, Arun Agni",InnoVen Capital
Neeman,Ecommerce,Pre series A,1000000.0,,An eco-conscious footwear brand making comfortable shoes using Merino Wool,2020,2017,"Taran Chhabra, Amar Preet Singh",Anicut Angel Fund
Chqbook,Fintech,Series A,5000000.0,Gurugram,"Marketplace for small business owners, offering them products around lending, credit cards etc",2020,2017,"Vipul Sharma, Rajat Kumar, Sachin Arora, Mohit Goel",Aavishkaar Capital
SMEcorner,Fintech,Series B,30000000.0,Mumbai,Financial lending firm to SMEs,2020,2014,"Bhatia, Sneha Shah",Paragon Partners
Oda Class,Edtech,Pre series A,113866383.83,Bangalore,"It offers content and material via video, adopting a dual-teacher model with IIT and NIT alumni",2020,2016,"Li Yong, Shushant Srivastava",Yuanfudao
Spinny,E-tail,Series B,43700000.0,Haryana,Used car retailing platform,2020,2015,"Niraj Singh, Mohit Gupta, Ramanshu Mahuar","Nandan Nilekani, Sanjeev Aggarwal"
goStops,Accomodation,,113866383.83,Delhi,A premium chain of youth hostels catering to the millennials,2020,2012,"Pallavi Agarwal, Pankaj Parwanda",Atraxn Partners.
Umeed Housing,Fintech,Series D,23000000.0,Haryana,Housing finance company,2020,2016,Ashutosh Sharma,Morgan Stanley Private Equity Asia
Vogo,Automotive,Series C,20000000.0,Bangalore,A scooter-sharing platform allowing users to rent a two-wheeler from specific designated pick up points,2020,2016,"Anand Ayyadurai, Padmanabhan Balakrishnan, Sanchit Mittal",Lightstone Aspada
Flick Stree,AI & Media,Series A,3000000.0,Mumbai,Artificial intelligence-based video publishing network,2020,2016,Saurabh Singh,Samsung Venture Investment
Qure ai,Healthtech,,16000000.0,Mumbai,Provides interpretations of radiology scans,2020,2016,"Prashant Warier, Pooja Rao",Sequoia India
MinionLabs,Machine Learning,,113866383.83,Bangalore,It leverages a Machine Learning-based approach to generate a comprehensive report on predictive analytics,2020,2016,Gokul Shrinivas,Indian Angel Network
Josh Talks,Media,Pre series A,1500000.0,Haryana,Community of young individuals providing a platform to showcase their stories,2020,2015,"Supriya Paul, Shobhit Banga",Media Development Investment Fund
PhoneParLoan,Fintech,,113866383.83,Delhi,Provides easy loans,2020,2015,Ringaile Noq,Accelerator MOX
RailYatri,Travel,,13800000.0,Noida,A complete Indian railways app,2020,2011,"Manish Rathi, Kapil Raizada, Sachin Saxena","Nandan Nilekani, Samsung Venture Investment Corporation"
AjnaLens,Deeptech,Pre series A,1500000.0,Thane,"It leverages technologies such as AR, VR & AI to offer hardware in areas such as education and defence",2020,2014,"Pankaj Raut, Abhishek Tomar, Abhijit Patil","Maharashtra Defence, Aerospace Venture Fund (MDAVF)"
Pepper,Content Marktplace,Seed funding,306900.0,Mumbai,End to end content creation platform,2020,2017,Anirudh Singla and Rishabh Shekhar,"Kunal Bahl, Rohit Bansal"
Rupeek,Fintech,,30000000.0,Bangalore,An asset backed online lending platform,2020,2015,"Amar Prabhu, Ashwin Soni, Sumit Maniyar","GGV Capital, Bertelsmann India Investments, Binny Bansal, Sequoia India, Accel Partners"
iMerit,IT,Series B,20000000.0,Kolkata,Turns information into data that is usable for machine learning processes,2020,2012,Radha Basu,CDC Group Plc
BharatPe,Fintech,Series C,75000000.0,Delhi,Digital payments platform,2020,2018,Ashneer Grover,Ribbit Capital
Invideo,Visual Media,,2500000.0,,Video production and editing platform,2020,2016,Sanket Shah,Sequoia Capital’s Surge
AvalonMeta,Edtech,,420000.0,,It combines higher education and competitive gaming,2020,2017,"Varun Mayya, Shashank Udupa, Abhinav Arora",Peerplays
Near Store,Ecommerce,Seed Round,300000.0,Mumbai,Enables a shop to create an online presence,2020,2016,,Sauce.vc
ElecTorq,Automobile,,113866383.83,Delhi,Electric vehicle startup,2020,2016,Anubhav Sharma,AdvantEdge
Prayaan Capital,Fintech,Seed Round,1200000.0,Chennai,"NBFC that lends to micro, small, and medium-sized enterprises (MSMEs)",2020,2016,"Madhan Mohan , Akash Chelvam",Accion Venture Lab
Sanfe,Hygiene,Pre series A,1100000.0,Delhi,Women health care and wellness product,2020,2016,"Archit Agarwal, Harry Sehrawat","SucSEED Venture Partners, BIRAC, Elixir Pharma, Titan Capital"
Go Desi,Foodtech,Seed Round,627300.0,Delhi,Provides traditional delicacies,2020,2018,Vinay Kothari,Rukam Capital
Swiggy,Foodtech,Series A,113000000.0,Bangalore,Platform to order food online from restaurants and getting it delievered,2020,2014,"Nandan Reddy, Sriharsha Majety, Rahul Jaimini",Prosus N.V
Whatfix,SaaS,Series C,32000000.0,Banglore,"Digital adoption platform that helps companies provide intuitive onboarding, training and support",2020,2014,"Khadim Batti, Vara Kumar",Sequoia Capital India
Unacademy,Edtech,Series E,110000000.0,Bangalore,Platform that offers online education in India,2020,2010,"Gaurav Munjal, Roman Saini, Hemesh Singh","Facebook, General Atlantic, Sequoia India, Nexus Venture Partners, Steadview Capital, Blume Ventures"
Zvesta,Proptech,,5500000.0,Gurugram,An online platform where users can search and buy properties listed by developers and brokers,2020,2015,"Rajan Dang, Anushree Srivastava",Hindustan Media Ventures
Dunzo,Logistics,,11000000.0,Bangalore,India-based hyperlocal delivery startup,2020,2014,Kabeer Biswas,Alteria Capital
Digit Insurance,Insurtech,,340000.0,Bangalore,General Insurance Company,2020,2016,Kamesh Goyal,"Virat Kohli, Anushka Sharma"
Yolo,Transport,Seed funding,600000.0,Gurugram,Intercity transportation,2020,2019,"Shailesh Gupta, Mukul Shah, Danish Chopra",Undisclosed
SmartVizX,VR & SaaS,Pre series A,1397000.0,,It developed India’s first VR-based design communication and collaboration product Trezi,2020,2015,"Tithi Tewari, Gautam Tewari",Rockstud Capital
MaxWholesale,Ecommerce,Series A,3000000.0,Delhi,B2B ecommerce platform for kirana stores,2020,2016,Samarth Agrawal,"IAN Fund-I,  Al Falaj Investment Company (AFI)"
Carbon Clean,Cleantech,,16000000.0,,Develops affordable carbon capture technology,2020,2009,"Aniruddha Sharma, Prateek Bumb","WAVE Equity Partners, Chevron Technology Ventures, Marubeni Corporation."
Onsitego,Sales & Services,Series B,19000000.0,,It offers post-purchase services through a network of brand authorised service centres throughout the country,2020,2016,Mahipal,Zodius Growth Fund
Genius Corner,Edtech,,250000.0,Noida,Framework to enable personalised learning using artificial intelligence (AI) and machine learning (ML).,2020,2014,"Vishal Khatter, Dheeraj Khatter, Dipak Varshney","Mahesh Mohta, Jyoti Arora, Nachu Subramanian, Srivats"
PlanetSpark,Edtech,,448500.0,Gurugram,Provides neighbourhood learning zones where children learn and develop 'new-age' skills under one roof,2020,2016,"Maneesh Dhooper, Kunal Malik","Indian Angel Network, Lead Angels, Hyderabad Angels"
CamCom,AI & Deep learning,,113866383.83,Bangalore,AI automation platform for enterprise quality control,2020,2017,"Ajith Nayar, Umesh, Mahesh Subramanian","Triton Investment Advisors,"
Simsim,Social Commerce,Series B,8000000.0,Bangalore,It enables community opinion influencers to sell products to thousands of micro-communities in India,2020,2016,Amit Bagaria,"Accel Partners, Shunwei Capital, Good Capital"
Shuttl,Transport,Series C,7975700.0,Delhi,App based bus aggregator serice,2020,2015,"Amit Singh, Deepanshu Malviya",SIG Global India Fund
HooLiv,Housing & Rentals,,113866383.83,Delhi,Student Co-living startup,2020,2016,"Chinmoy Mishra, Gaurav Vij, and Abhishek Verma",Kolte-Patil Family Office
ClassMonitor,Edtech,,113866383.83,Indore,The learning platform that blends curriculum-based activities for children,2020,2016,"Vijeet Pandey, Vikas Rishishwar",Ashwin Khorana
Friyey,Co-working,,113866383.83,Pune,Co working space startup,2020,2016,Yogesh Thore,Tarun Bhalla
Oga,Fitness,,330000.0,Bangalore,Provides interactive fitness experience to people across the world,2020,2016,Ashish Rawat,Inflection Point Ventures
Big Basket,Estore,,3500000.0,Bangalore,Online grocery store,2020,2016,"Abhinay Choudhari, Hari Menon, Vipul Parekh, VS Sudhakar",Trifecta Capital
CYFIRMA,SaaS,Series A,113866383.83,Bangalore,Offer cybersecurity services,2020,2016,Ritesh Kumar,Z3 Partners
Innoviti,,,5000000.0,Bangalore,Digital payments solutions company,2020,2016,Rajeev Agrawal,FMO
Paytm money,Fintech,,5600000.0,Bangalore,Wealth Management,2020,2010,Vijay Shekhar Sharma,One97 Communications
Vedantu,Edtech,Series C,24000000.0,Bangalore,Onine learning platform,2020,2016,"Saurabh Saxena, Pulkit Jain, Anand Prakash, Vamsi Krishna",GGV Capital
Yap,Fintech,,1402000.0,Chennai,Banking and payment products-focused API platform,2020,2016,"Madhusudanan R, Muthukumar and Prabhu","Amrish Rau, Kunal Shah, Jitendra Gupta"
Clover,Agritech,Series A,5500000.0,Bangalore,Provides agricultural solution to farmers working in the greenhouse production of vegetables and fruits,2020,2016,"Avinash BR, Gururaj Rao, Arvind Murali, Santhosh Narasipura","Omnivore, Accel Partners, Mayfield"
Nova Credit,Fintech,Series B,50000000.0,,Cross-border consumer credit startup,2020,2016,Nicky Goulimis,"Kleiner Perkins, Canapi Ventures, Index Ventures, Nyca Partners, General Catalyst."
CodingNinjas,Edtech,Series A,5200000.0,Delhi,Online learning platform,2020,2016,"Singla, Kannu Mittal, Dhawal Parate",Info Edge Ltd
Furlenco,Ecommerce,Series C,2200000.0,Bangalore,Furniture rental startup,2020,2011,Ajith Mohan Karimpana,Chowdry Associates
Brick&Bolt,,Pre series A,1500000.0,Bangalore,Operates in the residential construction space,2020,2018,"Jayesh Rajpurohit, Arpit Rajpurohit",Surge
HempStreet,Healthtech,Pre series A,1000000.0,,Manufacturer of ayurvedic medicines based on cannabis,2020,2019,Abhishek Mohan,Pharmacon Holdings
MoEngage,Marketing,Series C,25000000.0,Bangalore,Customer analytics and cross-channel engagement platform,2020,2016,"Raviteja Dodda, Yashwanth Kumar",Eight Roads Ventures
Classplus,Edtech,Pre series A,2500000.0,,It allows coaching centres to take their brick-and-mortar setup online,2020,2018,"Rustagi, Bhaswat Agarwal","Blume Ventures, Sequoia"
Chaayos,Beverages,,21500000.0,,Provides customised range of tea,2020,2012,"Nitin Saluja, Raghav Verma",Think Investment
PetPooja,SaaS,,2000000.0,Ahmedabad,Restaurant management software provider,2020,2011,Apurv Patel,Udaan
Altor,Tech,,113866383.83,,Makes helmets that are IoT and AI enabled,2020,2016,"Shamik Guha, Sayan Tapadar, Muhammad Bilal Shakil, Anirban Datta Gupta",Venture Catalysts
Pepperfry,E-market,Series F,40000000.0,Mumbai,Online home furniture marketplace,2020,2013,"Ambareesh Murty, Ashish Shah",Pidilite Industries
FirstCry,E-market,Series E,296000000.0,Pune,Baby products marketplace,2020,2010,"Supam Maheshwari, Amitava Saha",Softbank’s Vision Fund
Byju,Edtech,,200000000.0,,Provides online learning classes,2020,2011,Byju Raveendran,General Atlantic
Waycool,Agritech,Series C,32000000.0,Chennai,Food development and distribution services,2020,2015,Karthick Jayraman and Sanjay Dasari,LightBox Ventures
WorkIndia,HR tech,,6000000.0,,An online and mobile-based platform that connects companies with blue collar employees.,2020,2016,Kunal Patil,Xiaomi
Qyuki,Media,,3500000.0,Mumbai,Multi-channel broadcast network,2020,2016,"AR Rahman, Shekhar Kapur",Info Edge Venture Fund
Leap India,Agritech,Series B,30000000.0,Coimbatore,Agricultural warehousing and logistics company,2020,2016,Narain Karthikeyan.,Neev Fund
Picxy,Media,,250000.0,Hyderabad,Stock photo industry,2020,2016,Jitendra Emmani,"FirstCheque, Angellist India, Aakrit Vaish, Ranjith Radhakrishnan"
Krimanshi,Agritech,,20000.0,Jodhpur,Sustainable system to feed animals by valorizing food residues and surplus into highly nutritious feeds,2020,2016,Nikhil Bohra,Arunachal Pradesh Social Entrepreneurship Meet
NEETprep,Edtech,,113866383.83,Delhi,Provides crash course for NEET preparation,2020,2016,Kapil Gupta,IndiaQuotient
Dot Pvt. Ltd,Fintech,Seed Round,8000000.0,Gurugram,It provides digital transformation and commerce solutions to brick and mortar outlets,2020,2016,Shailaz Nag,"PayU, Fosun RZ Capital"
Kuku FM,Media,Series A,5500000.0,Mumbai,A podcast platform,2020,2016,"Lal Chand Bisu, Vikas Goyal, Vinod Kumar Meena",Vertex Ventures
SuperMoney,Fintech,Pre series A,1000000.0,Mumbai,Provides financial tools for effective business making,2020,2018,Nikhil Banerjee,Unitus Ventures.
Rebel Foods,Food tech,,4900000.0,,It runs internet kitchen,2020,2016,"Jaydeep Barman, Kallol Bannerjee",Alteria Capital
AlphaVector,E tailor,,113866383.83,Bangalore,It sells modern age bicycles named FROG,2020,2015,Sachin Chopra,"Avaana Capital, Titan Capital"
Fox Capital,Fintech,,2500000.0,Jaipur,Digital lending startup,2020,2019,Rakesh Sharma,Institutional Investors
Tribe Theory,Accomodation,,3500000.0,Bangalore,An entrepreneur-focused hostel chain present in multiple locations across the world.,2020,2016,Katie Russel and Daniel Wiegand,Tim Draper
Fleetx,SaaS,Series A,1402400.0,,Fleet management and predictive analytics platform,2020,2016,"Vineet Sharma, Abhay Jeet Gupta, Udbhav Rai, Parveen Kataria, Vishal Misra",Beenext
Embibe,Edtech,,12618300.0,Mumbai,It provides AI-based data analytics to personalise learning outcomes,2020,2016,Aditi Avasthi,Reliance Industries Limited (RIL)
Entri,Edtech,Seed Round,1400000.0,Kochi,It is a app that provides different types of learning content in local languages,2020,2017,"Mohammed Hisamuddin, Rahul Ramesh",Good Capital
Oye! Rickshaw,E-mobility,Series A,10000000.0,,App-based electric rickshaw hailing service,2020,2016,Akash Deep,Chiratae Ventures
Seal Professional,Edtech,Pre series A,113866383.83,Bangalore,Trains students in managemnt and leadership skills and also helps in placement,2020,2012,,Equanimity Ventures
Sprinng Foods,Food,,113866383.83,Mumbai,Provides Gluten-free food,2020,2016,Tarun Khanna,"Mistletoe, Info Edge Asia"
1MG,Healthtech,,9900000.0,Gurugram,Online pharmacy,2020,2015,"Prashant Tandon, Gaurav Agarwal, Vikas Chauhan",Bill & Melinda Gates Foundation
Aagey,Fintech,,113866383.83,Bangalore,Provides financial assistance to MSMEs,2020,2016,Akaash Shankar,"JITO Angel Network, Ketan Kothari, Girish Jain, Sunil Singhvi, Vinay Jain"
Doubtnut,Edtech,Series A,15000000.0,Gurugram,Multi-lingual digital solutions platform for students,2020,2017,"Tanushri Nagori, Aditya Shankar",Tencent
AdonMo,Ad-tech,,3000000.0,Bangalore,It is an online and outdoor advertising company,2020,2017,"Sandeep Bommireddi, Sravanth Gajula",Ant Financial
